{"status":"APPROVED","mode":"IMPLEMENTATION_REVIEW","task_id":"TASK-20260927-001","todo_id":"TODO-005","summary":"TODO-005 satisfies the production secret guard and Supabase-backed admin login limiting acceptance criteria. No blockers found.","blockers":[],"warnings":["Per-IP limiting can lock out admins sharing one public IP, and self-hosted deployments must ensure the front proxy overwrites X-Forwarded-For. The implementation records these as TODO-007 documentation items."],"evidence":["Read mandatory reviewer rules from .ai/reviewer/REVIEWER.md and required TODO artifacts.","src/lib/auth.ts implements NODE_ENV=production configErrors/configGuard, rejects missing/default ADMIN_PASSWORD and APP_SECRET, logs only variable names, and keeps dev defaults.","All 17 src/app/api route files have configGuard at handler entry; rg showed coverage for login, join, me, tag, teams, logout, and admin APIs.","src/app/api/admin/login/route.ts checks configGuard before parsing/counting, calls store.adminLoginAttempt before password verification, returns 429 with Retry-After, and clears attempts on successful login.","supabase/migrations/20260927160000_admin_login_attempts.sql adds RLS-protected admin_login_attempts plus service_role-only admin_login_attempt/admin_login_success functions using row locking.","runtime/static/TODO-005/summary.txt records VALIDATE_STATUS=PASSED, LINT_BASELINE=MATCH, TSC_EXIT=0; lint-delta.txt says no new lint findings.","evidence/TODO-005/prod-check-005.local.out.txt and hosted/prod-check-005.hosted.out.txt show AC1-AC8 passing, including invalid production secret cases, valid production login/join, lockout, shared DB counter across two next start instances, and anon denial.","evidence/TODO-005/build-no-secrets.log shows npm run build succeeded with ADMIN_PASSWORD, APP_SECRET, SUPABASE_*, and SUN_* absent.","runtime/web/TODO-005/report.md and browser-check.out.txt show BROWSER_STATUS=PASSED, 19/19 checks, and screenshots confirm the lockout message, admin load after reset, and participant join regression."],"regressions_checked":["TODO-004 auth-sensitive /t admin-mode behavior: guard-sweep output confirms default-secret admin cookie does not render admin mode under invalid config, while a real admin cookie still does under valid config.","Realtime-token auth path: guard-sweep output confirms 503 under invalid config, 200 with a real admin cookie, and 401 without/with forged default-secret cookie.","Participant auth helpers: browser validation confirms /join/DEMO01 reaches /race and sets cp_pid after auth changes.","Previously approved TODO-004 API regression: implementation evidence records regression-api-check-004 local and hosted as 57 PASS, failures=0."]}