{"status":"APPROVED","mode":"ANALYSIS_REVIEW","task_id":"TASK-20260927-001","todo_id":"","summary":"Analysis is sufficiently evidence-based and covers the required files, current behavior, architecture conflicts, shared modules, API/data contracts, and regression risks for the approved plan. I found no blocking issues requiring plan revision or analysis changes.","blockers":[],"warnings":["TODO-004 analysis contains an earlier risk note saying admin mode on /t is outside approved scope, but the later dedicated admin-mode section correctly treats it as required by request.md item 13 and TODO-004. Implementers should follow the later section.","TODO-006 analysis labels finished-session re-join as a question for the user while also recommending allowing it. This is not blocking because it does not invalidate the approved plan, but implementation should either follow the recommendation or document the chosen behavior clearly."],"evidence":["Read mandatory reviewer rules from .ai/reviewer/REVIEWER.md.","Read required artifacts: request.md, plan.md, analysis.md, and TODO-001 through TODO-007 under .ai/tasks/active/TASK-20260927-001.","Verified plan approval records exist in reviews/plan-20260927-195142.json and reviews/plan-20260927-201407.json.","Spot-checked src/lib/db.ts: current persistence uses fs/promises and data/db.json, has an in-process promise chain, seeds DEMO01, calls publish(), and implements the store methods described in analysis.","Spot-checked src/lib/race.ts: ordered tag handling, token/UID lookup, Korean validation reasons, ranking, and participant view shaping align with analysis.","Spot-checked src/lib/auth.ts and src/proxy.ts: default ADMIN_PASSWORD/APP_SECRET behavior and presence-only admin proxy match analysis.","Spot-checked current realtime files: src/lib/realtime.ts, src/lib/use-realtime.ts, and src/app/api/events/route.ts implement in-memory pub/sub and SSE as described.","Spot-checked participant and admin tag flows in src/app/t/[token]/page.tsx, src/app/race/page.tsx, src/lib/nfc.ts, and src/app/admin/sessions/[id]/ui.tsx; static token, UID-only, manual input, tag QR, NFC write, and token copy paths match the analysis.","Verified package.json, tsconfig.json, .gitignore, README.md, scripts/validate.sh, and .claude/CLAUDE.md facts cited by the analysis are materially accurate."],"regressions_checked":["Checked analysis against the approved plan for silent scope changes; no plan-invalidating drift found.","Checked that related files and direct dependencies were identified for persistence, realtime, SUN verification, participant/admin tag flow, auth hardening, re-join, and ops documentation.","Checked that regression risks are called out for shared race rules, data contracts, serverless constraints, RLS/anon exposure, concurrency, client bundle secret leakage, polling load, admin realtime authorization, Strict Mode double effects, and existing browser flows.","Checked that proposed validation evidence maps to Todo acceptance criteria and project validation conventions."]}