{"status":"APPROVED","mode":"PLAN_REVIEW","task_id":"TASK-20260927-001","todo_id":"","summary":"The plan accurately represents the user’s request and breaks it into reviewable Todos covering Supabase persistence, Vercel constraints, L4 SUN verification, removal of fallback checkpoint paths, admin baseline-refresh mode, production auth hardening, admin login limiting, participant re-join, and operational documentation. No blocking scope, ambiguity, or acceptance-criteria issues found.","blockers":[],"warnings":["TODO-002’s admin-only Supabase Realtime credential design is intentionally deferred to analysis; implementation review should verify it does not leak race data through anon Realtime subscriptions."],"evidence":["Read mandatory reviewer rules from .ai/reviewer/REVIEWER.md.","Read request.md and confirmed requirements 1-13 are represented or explicitly out of scope where appropriate.","Read plan.md and TODO-001 through TODO-007.","Targeted verification: package declares Next.js 16.3.4, matching the plan’s Next.js convention constraint.","Targeted verification: node_modules/next/dist/docs/index.md exists, supporting the plan’s instruction to read local Next docs before Next.js code changes.","Targeted verification: .claude/CLAUDE.md currently describes data/db.json persistence and SSE realtime, matching TODO-007’s planned documentation correction."],"regressions_checked":["Plan scope avoids implementation review and broad repository scan.","Todos are grounded in explicit user requirements or necessary technical dependencies.","Acceptance criteria are objectively reviewable for each Todo.","No unresolved product decision remains; re-join rate limiting is explicitly resolved as out of scope per request."]}