{"status":"APPROVED","mode":"FINAL_REVIEW","task_id":"TASK-20260927-001","todo_id":"","summary":"Final integrated review found no blockers. The complete implementation satisfies the original request: Supabase replaces file persistence, SUN-only tagging with baseline/replay protection is wired through participant and admin flows, production secret guard and admin login limiting are in place, participant rejoin works, Vercel/Supabase operations are documented, and final static/browser regression evidence passed.","blockers":[],"warnings":["Physical NTAG 424 DNA taps and Android Web NFC hardware scans were not exercised in this environment; the limitation is documented and covered by the ops rehearsal instructions."],"evidence":["Read mandatory reviewer rules and required artifacts: request.md, plan.md, analysis.md, all todos, implementation manifests, prior Todo reviews, state.json, and FINAL runtime/static evidence.","runtime/static/FINAL/summary.txt records ./scripts/validate.sh TASK-20260927-001 FINAL with VALIDATE_STATUS=PASSED, LINT_BASELINE=MATCH, and TSC_EXIT=0; lint-delta.txt says no new lint findings.","runtime/web/FINAL/report.md records BROWSER_STATUS=PASSED with 137/137 browser checks plus hosted API regressions for TODO-004 and TODO-006; representative screenshots for admin NFC registration, admin /t mode, rejoin race state, and ceremony reveal were inspected.","Inspected src/app/api/tag/route.ts, src/lib/sun.ts, src/lib/sun-keys.ts, src/lib/db.ts, and SUN migrations: /api/tag accepts only e/c SUN payloads, verifies server-side keys, records through record_sun_tag, consumes counters atomically, enforces baseline counters, and rejects token/UID-only bodies.","Inspected admin SUN routes and /t admin mode: admin-only inspect/register/key APIs verify admin auth, re-verify SUN parameters server-side, register or refresh baselines through register_tag_sun, and do not mount participant tagging for admin cookies.","Inspected src/lib/auth.ts, admin login route, all API guard coverage, and admin_login_attempts migration: production configGuard blocks default/missing ADMIN_PASSWORD or APP_SECRET, login attempts are persisted and locked per IP, and successful login clears attempts.","Inspected rejoin route, join form, DB rejoin migration, and final/API evidence: rejoin sets cp_pid only for exact session/team/normalized-name matches, duplicate normalized team names are DB-enforced, and pending SUN after rejoin submits exactly once.","Inspected .env.example, README.md, and .claude/CLAUDE.md: env coverage matches source reads, docs cover Supabase/Vercel setup, tag provisioning, race-day baseline refresh, rejoin, login lockout, and residual risks; current stack facts no longer describe db.json/SSE as active.","Targeted greps found no runtime src references to fs/promises, writeFile, data/db.json, /api/events, EventSource, or publish(); final secret scan reports zero hits across FINAL evidence/runtime files."],"regressions_checked":["Persistence/race rules: final hosted/local API evidence covers SUN success, replay rejection, baseline rejection, same-payload concurrency, fresh-counter concurrency, out-of-order, duplicate, finish, ranking, and cascade cleanup.","Realtime: final ceremony browser check covers admin Supabase Realtime with SUN-only tagging; participant polling and admin live updates are covered in TODO-004 final browser flow.","Security: anon/key exposure checks from prior Todo evidence plus final hosted API checks cover admin-only SUN routes, no participant key/UID leakage, no token/UID checkpoint acceptance, and no secret hits in evidence.","Auth and production guard: final TODO-005 browser flow covers lockout/reset and participant join regression; implementation evidence covers guarded API behavior in production.","Rejoin/user flow: final TODO-006 browser and hosted API checks cover normal join/team flows, rejoin via / and /join/[code], duplicate-name refusal, pending SUN replay prevention, and unchanged participant row counts."]}