{"status":"APPROVED","mode":"IMPLEMENTATION_REVIEW","task_id":"TASK-20260927-001","todo_id":"TODO-007","summary":"I found no blockers. TODO-007 satisfies the acceptance criteria: env coverage matches source reads, README covers the required deployment and operations topics, stale stack facts were corrected, source has no remaining db.json/filesystem runtime references, and recorded validation/build evidence passed.","blockers":[],"warnings":["I did not rerun `npm run build` because the review environment is read-only; I inspected the recorded build evidence instead.","`data/db.json` still exists locally as an ignored file, but runtime references and documentation claims were removed as required."],"evidence":["`.env.example` lists all 9 `process.env` vars read in `src/`, excluding platform `NODE_ENV`, and assigns no secret values.","`rg -n \"writeFile|fs/promises|data/db\\.json|/api/events|EventSource\" src` returned no matches.","`README.md` documents Supabase/Vercel setup, production secret requirements, tag provisioning, race-day baseline refresh, re-join, admin lockout, and residual risks.","`.claude/CLAUDE.md` now describes Supabase Postgres and polling/private Supabase Realtime as current stack facts.","`runtime/static/TODO-007/summary.txt` shows `VALIDATE_STATUS=PASSED`; `evidence/TODO-007/build.log` shows `BUILD_EXIT=0`; `checks.txt` shows env cross-check `MATCH`."],"regressions_checked":["No source runtime references remain for `data/db.json`, `writeFile`, or `fs/promises`.","No stale current-stack claim remains in `.claude/CLAUDE.md` for file persistence or in-memory SSE.","Runtime browser validation is not applicable because this Todo is documentation/config only."]}