{"status":"APPROVED","mode":"PLAN_REVIEW","task_id":"TASK-20260927-001","todo_id":"","summary":"The plan and Todos accurately represent the user request, keep the required scope, and provide objectively reviewable acceptance criteria. I found no blockers.","blockers":[],"warnings":["TODO-006 adds session code to the re-join flow in addition to team code + name. This appears justified by team-code uniqueness being scoped to a session and is mitigated by prefill on /join/[code], so I am not treating it as scope drift."],"evidence":["Read mandatory reviewer rules from .ai/reviewer/REVIEWER.md.","Read request.md: requirements include Supabase persistence, 100-300 participant scale, L4 NTAG 424 DNA SUN validation/replay rejection, Vercel deployment, participant polling/admin Realtime, no NFC fallback, disabling static/manual/UID-only checkpoint acceptance, manual baseline refresh, production secret guard, admin login limiting, and participant re-entry without attempt limiting.","Read plan.md and TODO-001 through TODO-007. Todos map to Supabase data layer, Realtime replacement, SUN verification, SUN UI/admin flow, production auth hardening, participant re-join, and Vercel/ops documentation.","Verified package metadata for the plan’s concrete Next.js claim: package.json has next 16.3.4 and node_modules/next/dist/docs is present."],"regressions_checked":["Plan excludes implementation review and broad repository scanning as required.","Checked Todo scope for speculative features, missing required request items, vague acceptance criteria, and unresolved product decisions."]}