{"status":"CHANGES_REQUIRED","mode":"IMPLEMENTATION_REVIEW","task_id":"TASK-20260927-001","todo_id":"TODO-002","summary":"Cannot approve because the mandatory reviewer rules and task artifacts are not accessible in this environment, so the implementation cannot be independently verified.","blockers":[{"id":"BLOCKER-001","target":"/Users/kimgarden/dev/nfc-walk-race/.ai/reviewer/REVIEWER.md and TODO-002 artifacts","problem":"Required review inputs are inaccessible.","evidence":"The review requires reading REVIEWER.md plus request.md, plan.md, analysis.md, todos/TODO-002.md, implementation/TODO-002.md, and state.json. The workspace path is not readable from the current sandbox, and approval escalation is unavailable.","required_change":"Re-run with the repository mounted/readable, or provide the required artifact contents and implementation manifest."}],"warnings":["No source or regression inspection was possible; this verdict is based only on missing access to required evidence."],"evidence":["The review instructions require independent repository evidence before approval.","Current environment is read-only with approval policy `never`."],"regressions_checked":[]}