{"status":"APPROVED","mode":"IMPLEMENTATION_REVIEW","task_id":"TASK-20260927-001","todo_id":"TODO-001","summary":"TODO-001 satisfies the approved acceptance criteria. The implementation replaces the JSON file store with a Supabase-backed server data layer, preserves the store/API contract, includes atomic SQL functions for team/tag mutations, enables RLS without anon/authenticated access, and records passing static, API, concurrency, cascade, and browser validation evidence.","blockers":[],"warnings":["No hosted Supabase verification was expected for this Todo because the project does not exist yet; validation is against the local Supabase stack as planned."],"evidence":["Read mandatory reviewer rules and required artifacts: request.md, plan.md, analysis.md, todos/TODO-001.md, implementation/TODO-001.md, and state.json.","Inspected changed manifest files: src/lib/db.ts, src/lib/supabase-server.ts, supabase/migrations/20260927120000_init.sql, supabase/config.toml, supabase/seed.sql, package.json, and validation artifacts.","AC1/AC4/AC5/AC6/AC7 evidence inspected in .ai/tasks/active/TASK-20260927-001/evidence/TODO-001/: db-reset, anon RLS, API parity/concurrency, and cascade checks all record passing results.","AC2/AC8 evidence inspected: src/lib/db.ts has no fs/path/db.json usage; Supabase env usage is isolated to src/lib/supabase-server.ts with server-only import; bundle scan records no service key/static leak.","Static validation inspected: runtime/static/TODO-001/summary.txt records VALIDATE_STATUS=PASSED, LINT_BASELINE=MATCH, no new lint findings, and TSC_EXIT=0.","Browser validation inspected: runtime/web/TODO-001/report.md records BROWSER_STATUS=PASSED with admin create/start/delete, participant join/team/tag flow, duplicate/out-of-order errors, finish, and admin ranking reload. Cited screenshots were visually checked."],"regressions_checked":["Existing race validation reason strings and order rules were compared against the SQL record_tag implementation and API evidence.","Route handler store usage was inspected; callers remain compatible with the new async Supabase store methods.","Team-level tagging behavior, duplicate prevention under 20 concurrent requests, finish handling, rankings, and session deletion cascades were covered by recorded API/browser validation.","RLS/security regression surface was checked via migration grants/revokes and recorded anon/publishable-key denial evidence."]}